{"schema_version":"1.0.0","adapter":"independent-document-audit","run_id":"run_0000380z202tx0dwz90g22c0x0","case_id":"case_0000380z202twbr15n6c3zge6m","environment":"local:1382c4208946a24a","started_at":"2026-08-20T11:50:00Z","finished_at":"2026-08-20T11:52:00Z","checkpoints":[{"name":"korean-phase-documents","kind":"authored-prose-and-machine-markers","before":{"finding":"English authored prose remained"},"after":{"prd":"Korean","plan":"Korean","design":"Korean","machine_contracts":"valid"}}],"assertions":[{"statement":"Korean workflow documents are readable in the user journey","passed":true,"layer":"L5","requirement_refs":["observable","variant:happy"],"actual":"Independent line-by-line audit found Korean authored prose in PRD Plan and Design","expected":"Korean user request produces Korean authored phase sections"},{"statement":"Language continuity regression preserves machine contracts","passed":true,"layer":"L7","requirement_refs":["observable","variant:happy"],"actual":"Language tests passed and frontmatter markers IDs paths commands and code symbols remained valid","expected":"Language repair preserves every machine-readable workflow contract"}],"redaction_status":"passed","spec_hash":"f3be6c2293c894a588537244c606c63cbd0177dd474696c530c68ec299a680ef","state_revision":1554,"layers":["L5","L7"],"tool_version":"independent-evaluator/1.0.0"}
